lang,orig_text,orig_translation
czech,"It was here in the Castle of St George in the hills above Lisbon that the newly crowned Portuguese King Manuel appointed da Gama to command a fleet of ships, to make discoveries and go in search of spices.","Bylo to tady na hradě svatého Jiří v kopcích nad Lisabonem kde nově korunovaný Portugalský král Manuel jmenoval da Gamu velitelem flotily lodí, aby vykonal objevy a šel hledat koření."
czech,"As we'II see, there was more than one killer app, but the one that really started the ball rolling was surely competition - both the main driver of capitalism and of the fragmented European state system.","Jak uvidíme, existovala více než jedna vražedná aplikace, ale fakt, který to uvedl do pohybu byla zcela jistě soutěž - hlavní tahoun kapitalismu a roztříštěného Evropského systému států."
czech,"When he and his fellow sailors rounded the Cape of Good Hope, the southernmost tip of Africa, they weren't wondering, as the Chinese had, if they could find some exotic animals to take home to their king.","Když on a jeho námořníci obepluli Mys Dobré naděje, nejjižnější cíp Afriky, nezajímali se jako Číňané, jestli by mohli najít nějaké exotické zvířata, která by přivezli domů svému králi."
czech,"well, you can find the answer here in the bowels of the British Library by looking at wonderful old maps like this one, which is of the city-state of Lubeck, dating back to 1530.","Můžete najít odpověď tady v útrobách Britské knihovny nahlédnutím do báječných starých map jako tato, která je z městského státu Lübeck, datující se do roku 1530."
czech,"I can't help feeling the message of these maps is ""divide and rule"", except that it was by being divided that the Europeans ended up ruling the rest of the world.","Nemůžu se zbavit pocitu, že zpráva těchto map je ""rozděl a panuj,"" až na výjimku to bylo tím, že rozdělení Evropané skončili jako vládci zbytku světa."
czech,"That means that the lord mayor, the sheriffs, the city council, the freemen, the Iiverymen and the aldermen are all more than 800 years old, making this the world's oldest autonomous commercial institution.","To znamená, že starosta, šerifové, městská rada, svobodní občané, řemeslníci a radní jsou všichni více než 800 let staří, to z nich dělá v tomto světě nejstarší autonomní komerční instituce."
czech,"And that's where power used to lie - with the drapers, the goldsmiths, the grocers, the haberdashers, ironmongers, mercers, the saIters, the shearers, the skinners - not forgetting the tailors and the vintners.","A to je to, kde ležela síla - obchodníci s textilem, zlatníci, kupci, galanterie, majitelé železářství, obchodníci s látkami, se solí, střihači, kožešníci - nezapomínejme na krejčí a vinaře."
czech,"Dating back to the middle Ages, they're a reminder of the amazing power - economic and political - that used to be wielded by London's craftsmen and merchants.",Kořeny sahají až do středověku jsou připomínkou úžasné moci - ekonomické a politické - kterou vládli Londýnští řemeslníci a obchodníci.
czech,"The English mechanical clock was not only more accurate than the Chinese water clock - it was also designed to be sold widely, rather than monopolised by the emperor's astronomers. IAN:","Anglické mechanické hodiny nebyly jen přesnější než Čínské vodní hodiny - byly také navrženy tak aby se široce prodávaly, spíše než zmonopolizovaná císařská astronomie."
czech,"Just take a walk from the Protecting Harmony hall to the middle Harmony hall, where the emperor had his private quarters, to the hall of Supreme Harmony, where the Dragon Throne itself sat. Harmony, harmony, harmony.","Stačí jen projít síni Ochranné Harmonie k síni Prostřední Harmonie, kde měl Císař své soukromé komnaty, do síně Nejvyšší Harmonie, kde stál samotný Dračí Trůn."
czech,"In China, Imperial rule was implemented by a Confucian bureaucracy, recruited on the basis of perhaps the most terrifying set of exam papers in all history.","V Číně, bylo císařské pravidlo realizováno podle konfuciánské byrokracie, přijímáni na základě asi nejděsivějšího souboru zkoušek v celé historii."
czech,"Thousands of wannabe mandarins would be locked in these cells, just three-and-a-half feet deep, about the same width, and only five-and-a-half feet high.","Tisíce aspirantů na mandaríny bylo uzamčeno v těchto celách, jen tři a půl stopy dlouhé, o stejné šířce, a jen pět a půl stopy vysoké."
czech,"During the time an examination lasted, the only movement allowed was the passage of servants, replenishing food and water supplies, or removing human waste.","V době trvání zkoušky jediný povolený pohyb byl průchod sluhů, doplňujících zásob potravin a vody, nebo odstraňování fekálií."
czech,"No doubt after nine long days shut in a shoebox, it was the most able, and the certainly most indefatigable, candidates who passed the imperial examination.","Není pochyb o tom, že po devíti dlouhých dnech zavřených v krabici od bot, jen nejschopnější a nejneúnavnější kandidáti složili císařské zkoušky."
czech,"As England's population growth accelerated in the late 1 7th century, trade brought an influx of new nutrients like potatoes and sugar, while colonisation allowed the emigration of surplus people.","Jak se Anglický populační růst zrychlil na konci 17. století, obchod přinesl příliv nových živin, jako jsou brambory a cukr, zatímco kolonizace dovolila emigraci přebytečných lidí."
macedonian,"I am speaking of Charles Foster Kane, the fighting liberal the friend of the workingman, the next governor of this state who entered upon this campaign... To point out and make public the dishonesty the downright villainy of Boss Jim W. Gettys' political machine now in complete control of the government of this state.","Зборуваме за Чарлс Фостер Кејн борбениот либерал, пријателот на работниците, следниот гувернер кој влезе во кампањата со само една намера да ги обелодени нечесноста и злото на политичката машина на Џим Гетиској целосно ја контролира"
macedonian,"On December 12, outnumbering us 3 to 1 on a narrow portion of the front, with massive support of the air force and a five to one edge in armored divisions, the enemy broke through our defenses, forcing their way across the Aksay. After 72 hours of fighting they have advanced 45 kilometers toward Stalingrad.","На 12 декември, создавајки трикратна надмоќ на тесен дел од фронтот, со постојана подршка на авијацијата, имајки 5-6-кратна надмоќ во тенкови, противникот ја проби нашата линија, ја премина реката Аксај и по три дена борби се приближи на 45 км во правец кон Сталинград."
macedonian,"Beyond that... this network may be the most significant profit center... of the communications complex... and based upon the projected rate of return on invested capital... and if merger is accomplished, the communications complex... may well become the towering and most profitable center... in the entire CCA empire.","Освен тоа... оваа мрежа може да биде најзначајниот центар за профит... на овај комуникацискиот комплекс... базирана на предвиденото повраќање на вложените пари... и ако планот е постигнат, комуникацискиот комплекс... може да стане најголемиот и најисплатлив центар... на цела CCA империја."
macedonian,"I want to present to the court a writ of habeas corpus a writ of corpus delicti and a writ of ad nauseam charging that my client is deprived of his rights of ipso facto lux et veritas and e pluribus unum. And I insist on his immediate release under the precedence set by Section 8, Paragraph 95 of Rogers v. Semper Fidelis.",Сакам да му го предочам на судот доказ за ослободуванје од недоследно апсење поради слаби докази за извршените злодела и нарушувањето на конституционалните права на мојот клиент.
macedonian,"On behalf of all the citizens of Philadelphia and the many who have been touched by your accomplishments and your untiring participation in this city's many charity functions, it is with tremendous honor that we present this memorial which will stand always as a celebration to the indomitable spirit of man.","Во име на граѓаните на Филаделфија и оние кои се погодени од вашите достигнувања и вашето неуморно залагање за голем број добротворни донации на овој град, со голема чест ви го представуваме овој споменик, кој засекогаш ќе стои во чест нескршливиот дух на човекот."
macedonian,"I want him brought right here with a big ribbon on his head and I want to look him straight in the eye and I want to tell him what a cheap, lying, no good, rotten low-life, snake-licking, dirt-eating, inbred, overstuffed ignorant, bloodsucking, brainless, dickless, hopeless heartless, fat-assed, bug-eyed, stiff-legged, spotty-lipped worm-headed sack of monkey shit he is!","Сакам да го донесат тука Со голема машна на главата Да го погледнам право во очите i da mu kaћemи да му кажам како е покварено, лажливо подмукло идиотско, крвопијско, моронско, импотентно бездушно и дебело гомно!"
macedonian,"Lecter altered or destroyed most of his patients' histories, so there's no record of anyone named Mofet, but I thought the ""yourself"" reference was too hokey for Lecter, so I figured he's from Baltimore and I looked in the phone book and there's a ""Your Self"" storage facility right outside of downtown Baltimore, sir.","Лектер ги преправил или уништил поголемиот број на истории на болести, па не постојат белешки на никој по име Мофет, но мислев да споменување на приватно искуство звучи премногу сентиментално за Лектер, па, прибидејќи е од Балтимор, погледнав во телефонскиот именик"
macedonian,"Mr. Kimble having considered all the factors and aggravation and mitigation in this case and found the offense was brutal and indicative of wanton cruelty it's judgment of this court, you will be remanded to Illinois State Penitentiary where you will await execution by lethal injection on a date to be set forth by the Attorney General of the State.","Г_не. Кемпбел, земајќи ги в предвид сите докази и околности во случајов, го оценувам нападот како брутален и безмилосен. Судот одлучи да бидете задржани во државниот затвор на Илиноис, се до денот на погубувањето кое ќе се изврши со инекција."
macedonian,"This was your great-grandfather's war watch and he wore it every day he was in that war and when he'd done his duty, he went home to your great-grandmother took the watch off, put it in an old coffee can and in that can it stayed until your granddad, Dane Coolidge, was called upon by his country to go overseas and fight the Germans once again.","Ова бил часовникот на прадедо ти во војната, и го носел секој ден додека бил во војна, а... кога му изминала должноста, се вратил дома кај прабаба ти, го извадил часовникот, го ставил во стара конзерва од кафе, и останал во конзервата... сѐ додека дедо ти, Ден Кулиџ, не го повикаа... да оди преку океанот за да се бори со Германците пак."
macedonian,"It was while at the courthouse that this man, his younger brother, Richard Gecko, a known armed robber and sex offender pulled off a daring daylight escape, resulting in the death of four Wichita law enforcement officers, and this woman, Heidi Vogel, sixth grade teacher, who was run over by the Geckos... during a high-speed pursuit through downtown Wichita.","Во текот на судењето, овој човек, помладиот Ричард Греко, познат разбојник и сексуален престапник, дрско побегна кога се убиени 4 полицајци и учителката Х.Вогел, која браќата Греко ја прегазија при бегството."
macedonian,"Kelly Lange here for Channel 3 lsland News. A tragic accident has claimed the life of a businessman identified as Steven Bishop, when a huge grand piano fell from the 17th floor of the Mayan Hotel... when a huge grand piano fell from the 17th floor of the Mayan Hotel... directly behind me and landed on his car.","Трагична несреќа го одзеде животот на бизнисмен идентификуван како Стивен Бишоп, кога огромно пијано падна од 17-тиот кат од Мајан хотелот... директно врз неговата кола."
macedonian,As the pesky poachers grunted and groaned... pushing and pulling the ponderous primate along... the trusty Tookie-Tookie bird was already winging to the rescue... making a bird-line for San Francisco... where George of the Jungle was trying to give the heiress Ursula... the courage to face her parents... by helping her discover the juju within.,"Одиме. Додека одвратните ловокрадци мумлаа и цимолеа, туркајќи го и влечејќи го тешкиот мајмун, доверливиот Токи веќе брзаше за спас кон Џорџ, летајќи брзо директно на пат за Сан Франциско, каде што Џорџ на Урсула сакаше да и' даде"
macedonian,"In a few hours, she'll probably be sane enough to work herself... into some sort of towering Jesus-based rage at the hazy recollection... of being seduced by some kind of cruel Samoan... who fed her liquor and LSD, dragged her to a Vegas hotel room... and then savagely penetrated every orifice in her little body... with his throbbing, uncircumcised member.","За неколку часа ќе биде доволно свесна, и ќе и стане јасно, иако сеќавањата ќе и бидат малку магливи, дека ја завел некој суров Самоанец, кој ја напил и издрогирал со ЛСД, ја одвлекол во хотел во Вегас, и потоа дивјачки пенетрирал во секој отвор на нејзиното мало тело, со својот набрекнат и необрежан ""врсник""."
macedonian,"We at our state-of-the-art solar-powered Biocyte building, recognize that eternal vigilance is the price of health, whether it's funding the teaching center at the Royal Prince Edward Hospital, removing aerosol products from the market... or braving the influenza quarantine at Bruny Island late last month.","Ние, во нашето уметничко дело, зградата на Биосет, со погонот на соларната енергија, дознавме дека вечната будност е цена на здравјето, било за финансирање на центарот за обука во болницата Ројал Принц Едвард, тргнувајќи ги аеросолните производи од пазарот... или спротивставувањето на грипот на островот Бруни, минатиот месец."
macedonian,"My friends, this is Larry David... the man who refused to hire a sister for a job... for which I was clearly qualified, because he's a racist, a bona fide racist... who preferred not to work with any black people under any circumstances... and gives all the good jobs to his white wife's white friends.","Пријатели мои, ова е Larry David... човекот што одби да ангажира сестра за работа... за која очигледно бев квалификувана, затоа што е расист, вистински расист... кој преферира да не работи со никој од црните луѓе, под никакви околности... и сите добри работи ги дава на белите пријатели на неговата жена."
macedonian,"This is a victory forthe mentally ill... and before Emil is taken on the boat... to the psychiatric ward at Rikers Island... it should be noted thatwhat he did... he wasforced to do... by Oleg Razgul, a dangerous and demented individual... who is at liberty right now... in the streets of New York, and both Emil and I...","Ова е победа за ментално болните. И пред Емил да биде префрлен со брод на психијатриската клиника треба да се знае дека за се она што го сторил, го натерал Олег Разгул исклучително опасна личност која се уште е на слобода некаде на улиците на Њујорк."
macedonian,"Do you understand that the world does not revolve around you... and your ""do whatever it takes, ruin as many people's lives""... so long as you can make a name foryourself as a journalist... no matter how many friends you lose... or people you leave dead and bloodied along the way... just so long as you can make a name foryourself as a journalist... no matter how many friends you lose... or people you leave dead and bloodied and dying along the way?","Дали ти разбираш дека светот не се врти околу тебе. и дека твоето ""правам што ќе посакам"" уништува други животи, додека ти си градиш име како добар новинар, без разлика колку пријатели ќе загубиш, или колку луѓе ќе оставиш раскрвавени додека го правиш тоа, се додека ти си градиш име како добар новинар, без разлика колку пријатели ќе загубиш, или колку луѓе ќе оставиш раскрвавени додека го правиш тоа ?"
macedonian,"I hope these gentlemen are treating you correctly... in the way you should be treated... and speaking of which, I'm going to Spain next week... so, um, if your kidnappers would like to contact me... they can get in touch with my people... and you know who they are... and, uh, the house is waiting for you right here,","Се надевам дека овие господа се однесуваат коректно... на начин како што треба да се однесуваат со тебе. така да, ќе одам во Шпанија следната недела... па, ако твоите киднапери сакаат да контактираат со мене... може да се јават кај моите луѓе... а ти знаеш кои се тие... и, а, куќата се уште те чека тука,"
macedonian,Let's get in the car... and we'll just drive and drive and drive and drive... and then we'll stop at the perfect place... and we'll stay there for as long as we want to... and then we'll get back in the car... and then we'll drive and drive and drive and drive... and we'll find another perfect place.,Да одиме во колата... и само ќе возиме и возиме и возиме... и после ќе застанеме на совршено место... и ќе останеме таму колку што сакаме... и пак ќе се вратиме во колата... и пак ќе возиме и возиме и возиме... и пак ќе најдеме друго совршено место.
macedonian,"Yes, well, Kafir Aghani has spent his entire life... defending the basic human rights... of his own people, and today's verdict... has been the result of five years of struggle... by this woman, Eleanor Heaney... to save the man she loves from an extradition order... that would've been tantamount to a death sentence.","Да, видете, Кафир Агани го поминал целиот свој живот... бранејќи ги основните човекови права на сопствениот народ? и денешната пресуда е резултат на петгодишната борба на оваа жена, Еленор Хини да го спаси свој сакан, од наредбата за екстрадикција која сигурно претставува воедно и смртна пресуда."
macedonian,"And do you, my handsome nephew take Natalie to be your lawful wedded wife through the good times and the bad times and the times she won't talk to you for months and even worse, when she will so you pretend you're asleep so she'll leave you alone but you lie there listening to her grind her teeth hour after hour like a fucking hacksaw?","И дали ти, мој згоден внук... за земаш Натали да биде твоја невеста... низ добрите времиња и лошите времиња... и кога таа нема да ти зборува со месеци... и уште полошо, кога таа ќе... па ти ќе се преправаш дека спиеш за да те остави на мира... но ти ќе лежиш само и ќе ја слушаш како чкрипи со забите... час по час... Како ебен бонсек?"
macedonian,"It was Liz who actually noticed it, but the resemblance to myself was absolutely uncanny. So we commissioned a lawyer to begin tracking down court records, passenger ship lists, that sort of thing, and it was finally confirmed just last week via what is known round here as the Lynchburg Convergence, where a certain Trevor Berman and a hood girl known as Ethel, wed and had two boys","Лиз беше таа што ја за- бележа,сличноста со мене е неоспорна.Затоа најмивме адвокат за да ги провери судските досиеа,патните листи и слично.Конечно минатата недела тој ни потвреди дека како резултат на она што овде е познататото како Линчберг- ско вкрстување во кое извесен"
macedonian,"Coming together at a maximum speed of let us say, 10 miles per hour. So you have a fly on the tire of bicycle ""B"" and the fly, who can travel at 20 miles an hour leaves the tire of �B� and flies to the tire of bicycle �A� and backwards and forwards until the two bikes collide and the poor little fly is squashed.","...Значи имате една мува на гумата од точакот Б и мувата, која лета 20 миљи на час, заминува од гумата на точакот Б и слетува на гумата од точакот А и обратно... итн... се додека двата точаци се судрат и кутрата мува е згмечена."
macedonian,"Well... we had to... to have a complete system, you need to have a kernel, which is the program that allocates resources to all the other programs, you need a compiler, which translates a program from readable source code that programmers can understand into numbers, mysterious numbers that the computer can actually run.","Па... требаше... за да имаме комплетен систем, треба да имате кернел, што е програма која ги распределува ресурсите за сите други програми, потребен ви е компилатор, кој знае да преведува програми од читлив изворен код, што го разбираат програмерите, во броеви,"
