lang,orig_text,orig_translation
macedonian,"We took it over as kind of the development part of Red Hat software and stayed that way till about November of 1995 when... a toilet we had in the apartment kind of exploded, flooded our downstairs neighbor and she got little upset and... the apartment folks found out we were running a business there","Го сфативме тоа како еден вид развоен дел на софтверот на Red Hat и останавме до ноември 1995 кога... тоалетот во станот во кој бевме експлодира поплавувајќи ја сосетката под нас која беше малку вознемирена, а... газдите на станот открија дека тука водиме бизнис"
macedonian,"That our big win, the big score that gave us mainstream visibility and credibility with investors came not because of bottom up evangelism from a bunch of engineers, but because one strategist at the top saw the potential power of this method and then essentially imposed that vision on everyone underneath him.","Нашата голема победа, која ни даде главна видливост и кредибилитет кај инвеститорите дојде не поради евангелизмот на група инженери од дното, туку поради еден стратег од врвот кој ја согледа потенцијалната моќ на оваа метода и потоа ја наметна таа визија на сите под него."
macedonian,"In other words, you play an actor... and the actor is having a tough time getting work... because he was on this mega-hit series, like a Seinfeld kind of series... and now this actor, after the series goes off the air... he can't get work anymore... because he's so identified with this character... that they won't let him do anything else.","Со други зборови, ќе играш актер... и актеров има тешкотии да најде работа... затоа што бил во мега хит серија, серија како Сајнфелд... и сега актеров, откога серијава завршува... не може никаде да најде работа... затоа што толку многу го поистоветуваат со ликот... не му даваат да прави ништо друго."
macedonian,"This is to us, for successfully... let me give you a little more... puttin' together something collectively... so ingenious as a team and a duo... that we should definitely be able to secure... a lot of food on the table for ourselves... as long as everything goes as nicely... as it's goin' right now.","Ова е за нас, за успешно... Дај да ти додадам малку... составување на нешто колективно, толку генијално како тим и како дует... што сигурно ќе можеме да си обезбедиме... многу храна на масата... се додека се оди фино... како што ни оди сега."
macedonian,"Burning love I'm just a hunk, a hunk of burning love I'm just a hunk, a hunk of burning love I'm just a hunk, a hunk of burning love I'm just a hunk, a hunk of burning love I'm just a hunk, a hunk of burning love I'm just a hunk, a hunk of burning love I'm just a hunk, a hunk of burning love I'm just a hunk, a hunk of burning love I'm just a hunk, a hunk of burning...",К Р А Ј
macedonian,I've been out of work... since this whole thing happened... and I had to have lots of doctors and lawyers... and I got stacks of mail from people... saying that they hate me... because I took away their heavyweight champ... and that I'm a gold digger and all that... but I say walk a mile in my shoes.,"Од кога се случи тоа, јас веќе не работам. Мора да имам многу доктори и адвокати. Добивам писма од луѓе кои ми пишуваат дека ме мразат затоа што им го одземав шампионот во тешка, и дека сум материјалистка."
bulgarian,"I'm about to follow water's journey around the planet from the oceans to the clouds, from a storm to a flood, because I want to experience the awesome power it can unleash.","Ще проследя движението на водата около планетата – от океаните до облаците, от бурите до наводненията, защото искам да усетя страховитата й мощ."
bulgarian,"Benedikte knows only slightly more about meteorology than I do, but the ratings show that her glowing smile and confident presentation keeps the audience happy and willing to receive the somewhat familiar weather forecasts.","Бенедикте разбира от метеорология съвсем малко повече от мен, но рейтингът показва, че блестящата й усмивка и уверен говор са приятни за зрителите и те гледат така или иначе еднообразните прогнози."
bulgarian,"There are many ocean currents that move water around our planet, but there's one, a master current out in the North Atlantic, that's the drive belt of our weather systems.","Съществуват много течения, пренасящи водата по планетата, но в северната част на Атлантическия океан е най-голямото и важно. Това е основата на нашия климат."
bulgarian,"The Conveyor's first stop is in the Indian Ocean, and, much later, in the Pacific Ocean, where the whole system then curves around and the cycle repeats itself.","Първата ""спирка"" на Конвейера е в Индийския океан, а след това, след много време, в Тихия океан, където прави завой и кръгът се затваря."
bulgarian,"After a 6,000-mile journey within the Conveyor, the water that fell as rain in Bergen over 500 years ago is about to become part of the biggest rainstorm on the planet.","След 10 000 км с Конвейера, дъждът от Берген преди 500 години ще стане част от една от най-големите бури на планетата."
bulgarian,"It's an intense period, because in a few months' time those monsoon breezes rushing in from the sea will reverse themselves, leaving just the merciless heat of the sun.","Това е напрегнато време, защото само след няколко месеца ветровете от морето ще се обърнат и ще остане само безпощадната горещина от Слънцето."
bulgarian,"Some will evaporate and many last only a few minutes. Even when there's plenty of water in a cloud, there's often a lack of the vital ingredient to make a raindrop - a little something for the moisture to gather round.","Известно количество ще се изпари, но дори и така ще остане предостатъчно, понякога дори прахът във въздуха не стига за водата - частичката, по която да полепне водата."
bulgarian,"With one corn field requiring 4,000 gallons of water each day and a single cloud containing just enough for one acre, the question is how do you tease the rain from the clouds?","С царевично поле, нуждаещо се от 1.5-2 тона вода дневно и един-единствен облак с точното количество вода, въпросът е как да свалим тази вода на земята."
bulgarian,"Whilst moving the dry ice into the freezer, they noticed the air around them became so cold that the warm water vapour in their breath instantly froze into tiny ice crystals.","Когато вкарвали сухия лед във фризера, забелязали, че въздухът се охладил толкова, те влагата в дъха им замръзвала на кристалчета."
bulgarian,"This chance discovery led the scientists to wonder if they put man-made crystals, imitating the ice, into the cloud, would the cloud produce more rain?","Това случайно откритие накарало учените да се запитат какво би станало, ако сложат тези кристалчета в облака. Дали от облака ще падне повече дъжд?"
bulgarian,"Here in Texas, in the afternoon, we get heavy thunderstorms, and we'll go up and fight through the main updraught, as that's where our chemicaliser is most effective.","В Тексас бурите са жестоки, а нашата работа е да отидем горе, в основното течение, където нашите химикали имат максимален ефект."
bulgarian,"The hurricane was so large, we knew it was going to affect with rain and strong winds all the north coast of Honduras, so warnings were out 20 hours in advance.","Ураганът беше толкова голям, че бяхме уверени, че ще има дъжд и силни вълни по целия северен бряг на Хондурас, и излъчихме предупреждение 20 часа предварително."
bulgarian,"The destructive power is in the very, very heavy rains, as circulation interacts with a very mountainous land mass - here Honduras, and Nicaragua down here.","Разрушителната сила се изразява в проливни дъждове, като въздушните маси взаимодействат с планинския терен - тук – Хондурас, и в Никарагуа."
bulgarian,The real disaster is yet to come in terms of mudslides and the very great catastrophes that occur as a result of several feet of water being deposited over the mountainous terrain.,Истинското бедствие тепърва предстои – калните порои. Най-големите катастрофи са когато дъждовете налеят метри вода на планинските скатове.
bulgarian,"Drawn out of the warm waters of the Gulf of Mexico by the Thermohaline Conveyor, the Gulf Stream runs practically the entire length of the North American coastline before reaching out east across the Atlantic towards the U""K"".","Издърпан от топлите води на Мексиканския залив от температурния Конвейер, Гълфстрийм обтича цялата дължина на Североамериканското крайбрежие, преди да достигне на изток до бреговете на Обединеното кралство."
bulgarian,"Six months after Mitch, an enormous number of seeds washed in, particularly on this beach - between 400-500 different species all from central South America on the Gulf Stream.","Шест месеца след Мич, Гълфстрийм довлече огромно количество семена, особено на тази бряг – около 400-500 различни растения, всички от средна Южна Америка."
bulgarian,"The force of water in a river can be lethal, but magnify that a thousand times and apply it to the ocean... and the results can be disastrous, as the residents of Hunstanton on the Norfolk coast learned to their cost.","Силата на водата в една река може да е смъртоносна, но я го умножете хилядократно и си представете океана... и резултатите са катастрофални, както научили на гърба си жителите на Хънстънгтън, Норфолк."
bulgarian,"By the time I got to this area to get these people off, they had certainly been on the roof of those houses since four or five o'clock in the afternoon, and this was like 11.30 at night.","Докато стигнем до хората, за да ги свалим, те със сигурност вече бяха стояли по покривите от 4 или 5 часа следобяда, а вече беше 11:30 вечерта."
bulgarian,"With wind blowing 120 mph, and they were soaking wet, and the rain and the freezing water, it would be amazing to me ""if all the 2""7""- 30 people"" that I got out all survive.","При вятър 200км/ч и напълно мокри, валящ дъжд и ледена вода, направо съм изумен как оцеляха всички 27-30 човека, които спасих."
bulgarian,"The beginning of the most disastrous of all the expeditions of the conquistadors, and yet one of the great epic stories in the history of the Americas.","Това е началото на най-пагубната конквистадорска експедиция, но и една от най-епичните случки в историята на двете Америки."
bulgarian,"Cabeza de Vaca wrote a remarkable account of his adventures and with it we set out to follow him across the Gulf of Mexico, to find out which way wind and tide might have taken him that autumn,","Кабеса де Вака води забележителен дневник на приключенията си. Благодарение на него, можем да проследим пътят му през Мексиканския залив, за да разберем накъде са го отнесли вятъра и отлива през онази есен,"
bulgarian,"That's interesting. When they pass the Mississippi mouth, they get caught up in a storm coming from the north that blows them right out to sea and nearly drowns them, in fact.","Когато са преминали устието на Мисисипи, са били хванати от приближаваща от север буря, която ги е запратила в открито море и за малко да ги потопи."
bulgarian,"You know, you look at all these great expeditions of the conquistadors and the terrible events that happened in the New World, Pizarro and everything else.","Поглеждаме към всички велики експедиции на конквистадорите и ужасните неща, които са се случили... Кортес, Пизаро и всичко останало."
bulgarian,"Yes, and there are places out here where there are oysters for several miles and, during low tide, they're exposed, probably at the time when they harvested them.","Да, има няколко места на които има стриди в продължение на мили, а по време на отлива се показват. Тогава са ги събирали."
bulgarian,"People before us have translated that word, or transcribed it, I should say, as margarita, which can mean pearls or pearl mica, which is abundant in the deserts of Arizona and New Mexico and they've used this to support the northern route.","Онези, които са се занимавали преди нас са превели думата, или по-точно - са я описали, като маргарита, което може да означава перли или перлена слюда. Пустините на Аризона и Ново Мексико са пълни с такава. Използвали са това, за да подкрепят теорията за маршрута на север."
bulgarian,"To follow them, we crossed the Rio Grande and entered the desolate landscape of horthern Mexico, , searching for Cabeza de Vaca's route into unknown America,","За да продължим по стъпките им, преминаваме Рио Гранде и навлизаме в пустите територии на северно Мексико в търсене пътя на Кабеса де Вака в непознатата Америка."
bulgarian,They went to him to become healed and they would go to him just like people would go to a medical doctor today and it's possible that could have saved their lives.,"Искали са да бъдат излекувани и са ходили при него така, както ние ходим на лекар и е възможно той да е спасявал животите им."
bulgarian,"You've got some? Great. ...and he tells us all sorts of fascinating things about the Indians, but he never speaks about his or any of his friends' relationships with the women.","Бил е тук седем или осем години, разказал ни е изумителни неща за индианците, но никога не е споменал за своите или на приятелите си отношения с индианките."
bulgarian,I don't think he would have lived that long in a native society without having taken on a woman and I suspect it wasn't one that was just a short-term scenario either.,"Не мисля, че би оживял толкова време сред местните, ако не си е бил взел жена. И не мисля, че е било само за една нощ."
bulgarian,"Their guides now led them towards another great native trade route across the Americas - the Shell Trail, which came down from the pueblos of A rizona and New Mexico all the way to the Pacific,","Водачите им ги водят до друг голям търговски маршрут в Америка - Шел Трейл, който се спуска от пуеблотата в Аризона и Ню Мексико чак до Тихия океан."
slovak,"Here are the decoded contents of the secret document About four hundred years ago, the Ming dynasty in China has in possession a diamond, which because of its peculiar shape resembled the head of Buddha.","Asi pred 400 rokmi vlastnila dynastia Ming v Číne diamant, ktorý svojou zvláštnou formou pripomínal hlavu Budhu."
slovak,"if you're in love and don't know where to go there's only one city, which has something no other city has it lies in the middle of the world's heart once you've had too much to drink, you'll know at once","Keď si zaľúbený a nevieš, kam ísť, tam je mesto, ktoré má niečo, čo žiadne iné na svete. Leží svetu srdca uprostred. Kedysi si vypil veľa, vieš hneď."
slovak,"just like a miracle a golden light falls down on us from paradise that only happens once, that won't ever be repeated, perhaps it's only a dream life can give this to you only once, maybe it'll be all over by tomorrow","Dnes pochopím všetko, čo sa stáva iba raz, nezopakuje sa zas, pravda krás. Ako zázrak svetlo zlata padá na nás z raja, čo sa stáva iba raz, nezopakuje sa zas, vari je to sen. Život iba raz ti prinesie, dozajtra možno skončí vše."
slovak,"life can give this to you only once, because every spring has only one May dear sun, world full of pleasure, you're as beautiful today as you had never been before all the sweet birds are practicing blissfully the sweet melody","Život iba raz ti prinesie, lebo každú jar len jeden máj príde. Slnko drahé, svet radosti plný, dnes si nádherné ako ešte nikdy. Vtáčiky štebocú tú sladkú melódiu."
slovak,"come, pick and chose that only happens once, that won't ever be repeated, perhaps it's only a dream just like a miracle a golden light falls down on us from paradise that only happens once, that won't ever be repeated, perhaps it's only a dream","príď, vyber a vezmi, čo sa stáva iba raz, nezopakuje sa zas, vari je to sen. Ako zázrak svetlo zlata padá na nás z raja, čo sa stáva iba raz, nezopakuje sa zas, vari je to sen."
slovak,In view of Allen's record here since his escape... our state has authorized us to assure you... that if he'll return voluntarily... and pay the state the expense it's been put to... he'll be pardoned in 90 days.,s ohľadom na Allanov záznam od jeho úteku... náš štát mi dal pravo uistiť vás... že keď dobrovolne zaplatí štátu... všetky výdaje spojené s jeho zadržaním... bude do 90 dní oslobodený.
slovak,"Finally, as evidence of the chain gang's value... as a character-builder, I have but to present to you... the very case that has been presented to us here today... the case of James Allen... who entered the chain gang as a worthless tramp... and who left it to become one of a great city's... most worthy and respected citizens.","Záverom, ako dôkaz dobrého vplyvu na väzňov... je prukázaný tým, ako sa vypracoval a uplatnil,... v prípade, ktorý nám bol dnes prezentovaný... James Allen... ktorý vstúpil do väzenia ako bezvýznamný tulák... a po návrate sa z neho stáva v tomto veľkom meste... vysoko cenený a ohodnotený významný občan."
slovak,"Finally, not only has James Allen been a model prisoner... patient and uncomplaining for a whole year... but we have presented letters from countless organizations... and prominent individuals... beseeching you to recommend his pardon.","Nakoniec, bol James Allen vzorný väzeň... vytrvalý a trpezlivý celý rok... dostávali sme dopisi od nespočetných organizácií... a prominentných osôb... ktorí doporučovali a prosili o milosť."
slovak,"A pathological condition that is not as rare as one might suspect. Exposure to catastrophes such as explosions, earthquakes and railway accidents - in short, exposure to fright and horror often triggers insanity.","Patologické podmienky, ktoré nie sú také neobvyklé, ako by sme si mohli myslieť - vystavenie takým katastrofám ako explózie, zemetrasenia a zrážky vlakov - skrátka vystavenie strachu a stresu obyčajne spôsobuje šialenstvo."
slovak,It is our unshakeable belief in ourselves... that is our hope for the youth... to carry on the work which has been put before them in the stormy years... of the revolt of 1918 in Munich... and which is already part of the entire German nation's history.,"Je to naša neotrasiteľná viera v samých seba, ktorá vkladá nádej do našej mládeže, aby pokračovala v tom, čo bolo započaté v búrlivých rokoch odboja, ktorý vyústil až do udalostí v roku 1918 v Mníchove, a ktorý je dnes už súčasťou Nemeckej národnej histórie."
slovak,"Hitler presents new colors to the assembled Party formations... touching each new flag to the Blutfahne, the ""Blood Banner""... carried by SS-Standartenführer Jakob Grimminger... the same man who carried this flag during the abortive Munich putsch of 1923","Hitler slávnostne prijíma nové vlajky hnutia, dotýkajúc sa každej ""Krvavým transparentom"" (Blutfahne) Nasleduje ho SS-Standartenführer Jakob Grimminger... muž, ktorý niesol túto vlajku počas Mníchovského puču v roku 1923."
slovak,"Only then, if we in the Party with our most obedient dedication... become the highest embodiment of National Socialist thought and being... then the Party will materialize... into an eternal and indestructible pillar of the German people and Reich.","A potom sa naša Strana, so všetkými svojimi ideálmi, stane tým najvyšším stelesnením myšlienky Národného socializmu, potom sa strana zhmotní... do večného a nezničiteľného piliera nemeckého ľudu a Ríše."
slovak,"And speaking of words, I'd like to say a few about the injustice... of keeping an innocent man locked up for three months... in such filth and heat and ill-feeding that my chief regret is I didn't try... to pull down the filthy fellow that sits on the throne.","A hovoriac o slovách, rád by som povedal niekoľko o nespravodlivosti... o zadržovaní nevinného muža zatvoreného počas troch mesiacov... v takej špine a horúčave a o zlej strave, že moja hlava ľutuje, že som sa nepokúsil... zvrhnúť toho hnusného chlapíka, ktorý sedí na tróne."
slovak,The death to which you're dooming hundreds of poor men daily... in a frantic effort to send their souls to perdition before your own... is a light pleasantry... compared to the bleeding death in the lungs... to which the great Judge has condemned you.,"Smrť, na ktorú vy odsudzujete stovky úbohých ľudí denne v šialenom úsilí poslať ich duše do zatratenia pred vašou vlastnou je ľahký žart oproti krvácajúcej smrti v pľúcach na ktorú vás odsúdil Najvyšší Sudca."
slovak,"Therefore, I instruct you, gentlemen of the jury... that inasmuch as Peter Blood has admitted... aiding a traitor to your king... you do bring in a verdict of guilty... that he may be hanged... for the high treason he has committed.","Preto vám nariaďujem, páni porotcovia, že vzhľadom k tomu, že Peter Blood priznal pomoc zradcovi vášho kráľa, vyneste rozsudok o vine, aby mohol byť obesený za vlastizradu, ktorú vykonal."
slovak,Send out word immediately that the King is graciously pleased to command... that all rebels convicted but not yet hanged... be gathered together... and shipped by the first available boats to the Americas.,"Rozpošlite ihneď správu, že kráľ s potešením rozkázal, že všetci usvedčení rebeli, ktorí ešte neodvisli, majú byť zhromaždení a nalodení na prvé dostupné lode do Ameriky."
